{
  "client": {
    "interface": []
  },
  "content_revision": "sha256:3b8508f3b6734f28e2d77894c67329a05fd20e0828739d00b05dadc2c2d7da20",
  "counts": {
    "available": 4,
    "entities": 5,
    "hints": 1,
    "published": 5,
    "retired": 1
  },
  "features": {
    "persist_hints": false,
    "persist_interaction_progress": false
  },
  "files": [
    {
      "path": "Pack.lua",
      "sha256": "61e5c2a07bd0dfa122edb535205ceffab1cbf2193387c2b39808067008fdcbb9"
    }
  ],
  "flavor": "fixture_alt",
  "generated_from": {
    "editorial": "sha256:4162130ec1b123cfcb1f796c038823793554595fa89130226cff3060b4339f51",
    "generator": "0.1.0",
    "world": "sha256:dbbfa061dd1a03bb089ad8a89206f96c3e3f005f93bf48a0e7ff10503fe65f69"
  },
  "locales": [
    "esES"
  ],
  "pack_schema": 1,
  "schema": "chronicle.pack.manifest/1"
}
