{
  "client": {
    "interface": [
      11507
    ]
  },
  "content_revision": "sha256:4a640326192e6bf211bba13ba40dd75ef5ab9cd3867db406d85115567752b95a",
  "counts": {
    "available": 5,
    "entities": 7,
    "hints": 2,
    "published": 7,
    "retired": 1
  },
  "features": {
    "persist_hints": false,
    "persist_interaction_progress": false
  },
  "files": [
    {
      "path": "Pack.lua",
      "sha256": "3dfa768a7d7adab8e1d821dd2667db2d9afefdef944ea391ef06b3cc447d535b"
    }
  ],
  "flavor": "era",
  "generated_from": {
    "editorial": "sha256:ec2905f31d0459c6e173865a4a19eb7d84168d905505ba8d191c09530d2fe080",
    "generator": "0.1.0",
    "world": "sha256:9d2cadafa4aa0f88c53852ecdb20f816a60b83f5c0c826b7fddc1591d4eb98ac"
  },
  "locales": [
    "esES"
  ],
  "pack_schema": 1,
  "schema": "chronicle.pack.manifest/1"
}
