{
  "client": {
    "interface": [
      11507
    ]
  },
  "content_revision": "sha256:ec9239e17730d65db2a54be303c39df54d33d4eee29c10d7f00a0da2feebe782",
  "counts": {
    "available": 1,
    "entities": 5,
    "hints": 0,
    "published": 5,
    "retired": 0
  },
  "features": {
    "persist_hints": false,
    "persist_interaction_progress": false
  },
  "files": [
    {
      "path": "Pack.lua",
      "sha256": "86a8553bc50e29aace1cd6fcc7af2069060a3101023b628d94658820a6bc4d7d"
    }
  ],
  "flavor": "era",
  "generated_from": {
    "editorial": "sha256:3823ac8f1c971d01ee7d57abc04556ee3e2c655a45d363f55d7a17d4ca58b26d",
    "generator": "0.1.0",
    "world": "sha256:0bfbe30806727a28c4fd07b8b3159ffcaa81eb3a61d73ab1063b4685dd7cd94b"
  },
  "locales": [
    "esES"
  ],
  "pack_schema": 1,
  "schema": "chronicle.pack.manifest/1"
}
